{
  "schema_version": 1,
  "run_id": "2026-10-03-EX-1",
  "implementation_id": "EX-1",
  "cycle": 2,
  "status": "PASS",
  "reviewer": { "provider": "codex", "session_id": "rev-4d21" },
  "reviewed_at": "2026-10-03T15:12:00Z",
  "evidence_reviewed": ["brief", "git_diff", "changed_files", "validation_output", "adrs", "implementer_summary"],
  "findings": [
    {
      "id": "R2-1",
      "severity": "nit",
      "requirement": "Captions longer than the platform limit are rejected with a clear validation error",
      "evidence": "Error message says 'chars' while other validators say 'characters'",
      "affected_files": ["src/content_automation/scheduling/caption_limits.py"],
      "required_correction": "Optional: align wording with existing validators"
    }
  ]
}
